character,line
Daphne Blake,how about two scooby snacks
Daphne Blake,maybe well get a clue to help us find the monster or at least the van vandals
Daphne Blake,look
Daphne Blake,good you speak english
Daphne Blake,you do
Daphne Blake,no i think you skipped that part
Daphne Blake,website
Daphne Blake,what did you say to him
Daphne Blake,none of this looks familiar are you sure were going the right way
Daphne Blake,were sunk
Daphne Blake,okay fred how do you say hopelessly lost in spanish
Daphne Blake,do you suppose well meet any wild animals
Daphne Blake,coyotes
Daphne Blake,oh my
Daphne Blake,we thought we heard el chupacabra listen
Daphne Blake,yeah but what
Daphne Blake,oh no the mystery machine
Daphne Blake,scooby doo where are you
Daphne Blake,yeah but now that were save from that creepy bigfoot you might want to slow down a little
Daphne Blake,right in front of a gas station what are the chances of that
Daphne Blake,what happened
Daphne Blake,here let me help wheres the bump i dont see anything
Daphne Blake,guys look
Daphne Blake,looks like the one we have back home
Daphne Blake,leave it to shaggy to come to a museum and immediately find the toys
Daphne Blake,freddy
Daphne Blake,where am i
Daphne Blake,boy am i glad to see you guys
Daphne Blake,im not sure i was blindfolded the whole time by that fake museum guide and her warrior friends
Daphne Blake,whats going on
Daphne Blake,quick in here
Daphne Blake,ew theres a bunch of spiders down here
Daphne Blake,just act natural
Daphne Blake,i guess the corrindo was right things in mexico arent always as they seem
Daphne Blake,but whats to be gained from that
Daphne Blake,good point but what does that have to do with el chupacabra
Daphne Blake,i dont we can roll out the supernatural
Daphne Blake,if the creatures at the pyramids were special affects they were pretty special
Daphne Blake,velma did you save the torn label from the fake warriors costume
Daphne Blake,officers
Daphne Blake,so he terrorize the tourists with the chupachapra attacks hoping to ruin the oteros hotel business and force them to sell
Daphne Blake,and by kidnapping me and framing us as vandals he was able to derail our investigation and create bad publicity for the pyramids
Daphne Blake,it sure doesnt look like a special effect to me
Daphne Blake,hardly it takes two to tango
Daphne Blake,so guess there never was a real chupacabra i wonder how that myth got started
Daphne Blake,who are you
Daphne Blake,guess you beat us to the punch mr ravencroft
Daphne Blake,yeah we can use a break from all these spooky mysteries
Daphne Blake,wow this color is spectacular eh guys
Daphne Blake,do many people come here often
Daphne Blake,youve heard of them fred
Daphne Blake,and now shes haunting the town
Daphne Blake,oh cornhouse dolls arent they cute fred
Daphne Blake,youre gonna regret that offer ben
Daphne Blake,you have some cool things here ben
Daphne Blake,so hows the food
Daphne Blake,okay but after youre finished meet us at the puritan village
Daphne Blake,boy ben seems to be pretty obsessed with that book
Daphne Blake,we should give it a chance ben
Daphne Blake,oh can you at least get off me first freddy
Daphne Blake,theres no one here now
Daphne Blake,and in a perfectly straight line
Daphne Blake,what is that
Daphne Blake,so fred why do you always pair us up
Daphne Blake,are you sure your not just stuck on thorn freddy
Daphne Blake,if i didnt know better i say that shes a witch
Daphne Blake,hey whats going on
Daphne Blake,so what happened guys
Daphne Blake,what was that all about velma
Daphne Blake,mr mcknight the pharmacist
Daphne Blake,you mean you didnt know
Daphne Blake,witches
Daphne Blake,you okay ben
Daphne Blake,it looks kinda evil belonging to a wiccan healer
Daphne Blake,whered he go
Daphne Blake,are we ever glad to see you
Daphne Blake,no scooby does
Daphne Blake,freddy
Daphne Blake,thank goodness
Daphne Blake,just sun fun and 
Daphne Blake,so freddy how old are you going to be
Daphne Blake,they are very very scary
Daphne Blake,sure is great to see you again mr and mrs jones
Velma Dinkley,really how can you tell
Velma Dinkley,we are you know how i like reading in a foreign language listen to this gang climbers on mount everest claim to have seen the abominable snowman a mysterious creature believed to exist in the high himalayas
Velma Dinkley,i hear you can i have my cheeks back
Velma Dinkley,home to mount everest and the headline making mystery of the abominable snowman
Velma Dinkley,sorry daphne but it looks like youre trading in your new heels for snowshoes
Velma Dinkley,not abdominal freddie its pronounced abominable
Velma Dinkley,there are a number of different theories regarding the abominable snowman and there have been many photographs taken of the yetis footprints
Velma Dinkley,the yeti is the name used by the local mountain people to describe the creature
Velma Dinkley,not subliminal fred now youve got me all mixed up
Velma Dinkley,here we go again
Velma Dinkley,jinkies daphne it must be exciting to visit blake castle the ancient home of your scottish ancestors
Velma Dinkley,are you by chance referring to the legend of the loch ness monster
Velma Dinkley,im not so sure about that
Velma Dinkley,i believe its a mystery this monster is different there have been over 2000 loch ness monster sightings dating all the way back to 540 ad thats almost 1500 years ago
Velma Dinkley,we got to solve this mystery tonight and i know just the person to help us do it professor pembrooke come in professor do you read me
Velma Dinkley,she couldnt way down at the end of the loch right now
Velma Dinkley,jinkies you have mail
Velma Dinkley,mexico the art the mesuems the pyramids i’m there
Velma Dinkley,do you realize we’ll be there for the annual of the day of the dead celebration
Velma Dinkley,a holiday in which family gather at the cemetery and celebrat their ancestors who are allow to come back to earth for two days
Velma Dinkley,actually
Velma Dinkley,it didn’t take scooby to start livin’ la vida mocha
Velma Dinkley,the purpose of fiestas and siestas shaggy is to provide sustenance and rest for another tradition: hard work
Velma Dinkley,con man
Velma Dinkley,we were hoping to watch the preparations of day of the dead festivities
Velma Dinkley,i’ve read about him he’s mexico’s version of the bigfoot
Velma Dinkley,and what was all that noise
Velma Dinkley,oh no you dont this is no time to be chicken its all for one and one for all
Velma Dinkley,i dont think so i dont know what it is
Velma Dinkley,good idea fred we can videotape them
Velma Dinkley,back to you
Velma Dinkley,hold on you two we came here today to get to the bottom of this chupacabra mystery
Velma Dinkley,looks like they need some friendly persuasion would you each do it for a scooby snack
Velma Dinkley,great so far it appears as if the chupacabra is nocturnal now that its getting dark we should do a thorough search of the town
Velma Dinkley,yes of quetzalcoatl the feathered serpent ive read about him he was revered by the aztecs as the god of all things good
Velma Dinkley,wow are you a medicine man
Velma Dinkley,we were hoping you can tell us something about el chupacabra
Velma Dinkley,greed but what does this have to do with el chupacabra
Velma Dinkley,we better get back to the others and warn them
Velma Dinkley,thats polaris the north star we should be headed in the opposite direction
Velma Dinkley,it looks like the woods get thicker up ahead
Velma Dinkley,mostly coyotes and jaguars and boars
Velma Dinkley,and boars
Velma Dinkley,like maybe that
Velma Dinkley,jinkies el chupacubra
Velma Dinkley,but crate fluoid it isnt someone must have tampered with the brakes on the mystery machine
Velma Dinkley,shaggy
Velma Dinkley,jinkies perfect timing if you and the others havent show up when you did we be mexican history
Velma Dinkley,look what better place than a museum to learn about the past
Velma Dinkley,shes gone
Velma Dinkley,we cant leave here until we find daphne
Velma Dinkley,look at this it looks like some sort of ripped label from one of the warriors costumes mile enter i wonder what that means
Velma Dinkley,look a trap door
Velma Dinkley,look heres a door
Velma Dinkley,ive read about these the pyramids were created by the olmec indians who built mesoamericas first great civilization
Velma Dinkley,look at the top its daphne
Velma Dinkley,what happened to you
Velma Dinkley,thats odd that statue wasnt here before
Velma Dinkley,no guys actually they are scopions
Velma Dinkley,jinkies we must be in the ancient tombs
Velma Dinkley,look we can disguise ourselves by wearing the traditional clothing of the native indian skeletons
Velma Dinkley,magical eagle huh i didnt buy this animatronic impostor for one minute
Velma Dinkley,jinkies and she is still missing
Velma Dinkley,el chupacabra is scaring off the tourists making businesses suffer
Velma Dinkley,maybe hes a fake
Velma Dinkley,real or fake somebodys been following us
Velma Dinkley,lets look at me video tape again
Velma Dinkley,looks like your spanish lessons are finally paid off
Velma Dinkley,sure did but i still dont know what it means
Velma Dinkley,we suspected that mile and enter are part of bigger words and look we were right smiley entertainment when mister smiley was unable to convince the locals to sell their land for his new theme park he turned to the otero family
Velma Dinkley,and then he did everything he could to prevent us from revealing his scheme
Velma Dinkley,seen to be his chief competitor for the dollars of tourists all over the world
Velma Dinkley,im beginning to
Velma Dinkley,hmm i seem to recall someone mention coffee grinds coming out of their ears from working at the café all day
Velma Dinkley,like all myths i guess since the beginning of time men and women have loved to tell stories and what better reason for creating them than to explain the many things we dont understand and maybe never will
Velma Dinkley,i dont believe it youre ben ravencroft the famous horror writter
Velma Dinkley,and griswald disgruntled archaeologists from the museums babylonian project they were upset with you for cutting their funding dr dean
Velma Dinkley,mr ravencroft i am a huge fan of your work i have read all your books in which my opinion are the best horror stories ever written
Velma Dinkley,you know my name
Velma Dinkley,oh please what we do pales in comparation with the sheer ponderable fright of your novels
Velma Dinkley,i mean take the dead mole for example; oh that creepy jewerly store owner was an incredibly complex character
Velma Dinkley,really oh that would be great uh wouldnt it gang
Velma Dinkley,and that scene at the end where the caretakers flesh dissolved was so brilliant i 
Velma Dinkley,already
Velma Dinkley,i thought you said this was a quiet little town
Velma Dinkley,jinkies looks like you got a ghost in your own backyard ben
Velma Dinkley,this is amazing mayor
Velma Dinkley,so you say a ghost has been appearing here
Velma Dinkley,just like the salem witch trials many men and women who were a bit different or didnt conform to the codes of the colony suffer the same fate
Velma Dinkley,wow would we ever shaggy well meet up with you later
Velma Dinkley,wow so this is where it all started
Velma Dinkley,jinkies this is a dream come true
Velma Dinkley,id reed about them wiccans were people who were in turned with the forces of nature and use them for healing purposes
Velma Dinkley,hey i saw a huge oak tree like that in the town square
Velma Dinkley,wiccans have been misunderstood accused of sorcery in fact the word witch comes from wicca
Velma Dinkley,is there anything left in the kitchen
Velma Dinkley,bens already gone ahead
Velma Dinkley,whats going on guys
Velma Dinkley,you saw the witchs ghost
Velma Dinkley,hmm you said she threw fire balls right
Velma Dinkley,is this the street she chased you guys
Velma Dinkley,this is getting interesting ben
Velma Dinkley,lets go see
Velma Dinkley,yeah very mystifying
Velma Dinkley,ill say
Velma Dinkley,gee why is it that you always pair off with daphne fred
Velma Dinkley,never mind it is a good idea you guys stay here we wanna take another look at where the guys saw that ghost
Velma Dinkley,come on
Velma Dinkley,lets take a look behind these trees
Velma Dinkley,what are these tire tracks doing back here
Velma Dinkley,right lets see where these tracks lead
Velma Dinkley,shh
Velma Dinkley,jinkies its the mayor
Velma Dinkley,i dont know but were going to find out whats in that barn
Velma Dinkley,fine you check the barn and well follow the mayor
Velma Dinkley,theres gotta be another way in here
Velma Dinkley,just a little higher
Velma Dinkley,thats great
Velma Dinkley,im fine come on
Velma Dinkley,its still warm ben
Velma Dinkley,thats the mystery
Velma Dinkley,me either
Velma Dinkley,thats no mystery
Velma Dinkley,he did there goes my cherry picker theory
Velma Dinkley,like what
Velma Dinkley,sorry about that mayor scooby and shaggy just lose it when they get scared in fact im worried that staying in oakhaven might just be too frightening and experienced for them i think we should leave
Velma Dinkley,but i need to get one more clue before the night is over then i think ill can solve the mystery of the witchs ghost before tomorrows autumns fest
Velma Dinkley,heres what were going to do
Velma Dinkley,help me i have fallen and i cant get up now yes you did it guys
Velma Dinkley,maybe i can explain i found flash powder residue where shag and scoob saw the ghost this is the device to throw the fireballs which was just watts of flash paper he got it from his daughters stage prompts
Velma Dinkley,its the cherry picker that made the ghost flie above the trees with the use of an extention device and theres the fan that created the eerie wind it took more than one person to pull of this scam isnt that right jack
Velma Dinkley,it would take someone pretty strong to hoist mr mcnight around
Velma Dinkley,that goes for all of you
Velma Dinkley,sure there had to be more people involved to make this hoax work
Velma Dinkley,shaggy you still have the shoe buckel scooby found today
Velma Dinkley,scooby can you show me exactly where you found this
Velma Dinkley,right i believe this is was left of the tree where sarah did her healing you never even noticed it because it was cut down hundreds of years ago its up to you to dig it scooby
Velma Dinkley,then how about a scooby snax
Velma Dinkley,two scooby snax
Velma Dinkley,the box
Velma Dinkley,ben that doesnt seem to be a journal at all
Velma Dinkley,you lied to me ben
Velma Dinkley,i know why because if we know what that book was we would never have helped him
Velma Dinkley,no
Velma Dinkley,ben please stop
Velma Dinkley,no
Velma Dinkley,no frankly i dont
Velma Dinkley,how could i ever liked your novels now guys grab the book
Velma Dinkley,you wont get away with this ben ravencroft
Velma Dinkley,ive got an idea guysbut we need that book
Velma Dinkley,im sorry guys but you two are the fastest
Velma Dinkley,dont worry well created a diversion for you
Velma Dinkley,how about for a whole box of scooby snacks
Velma Dinkley,good luck
Velma Dinkley,jinkies
Velma Dinkley,jinkies
Velma Dinkley,wait thorn we need your help
Velma Dinkley,we need you to read the spell to defeat sarah ravencroft
Velma Dinkley,but you said you were part wiccan
Velma Dinkley,it doesnt matter you have wiccan blood meaning you can read the spell so you can send sarah ravencroft back to where she came from
Velma Dinkley,scooby over here
Velma Dinkley,the book the book
Velma Dinkley,heres the spell its up to you thorn
Velma Dinkley,but not to a wiccan
Velma Dinkley,hurry thorn read
Velma Dinkley,thorn its working
Velma Dinkley,ben ravencrofts last book is one the world will never buy
Velma Dinkley,in other words a cruise
Velma Dinkley,hey fred it sure was nice of your parents to invite us all on a cruise for your birthday
Velma Dinkley,theres no one around here like that unless you think hawaiian sure is black socks and sandals are scary
Velma Dinkley,and a new set of eyeballs
Velma Dinkley,thank you
Velma Dinkley,and thats still not enough
